2261,春元中醫診所,台南市中西區中華西路二段626號
2262,世樺中醫診所,台南市北區公園路735號
2263,大醫精誠中醫診所,台南市北區文賢路611號
2264,艾苜中醫診所,台南市北區北安路一段239號
2265,心連心中醫診所,台南市安平區國平里華平路178號
2266,中義中醫診所,台南市南區金華路二段33巷40號
2267,惠安中醫診所,台南市南區西門路一段551號
2268,秉聖中醫診所,台南市北區西門路四段602號
2269,陳天助中醫診所,台南市北區海安路三段755號
2270,湯燕雪中醫診所,台南市北區和緯路三段182號
2271,德州中醫診所,台南市安南區安和路一段127號
2272,慶恩中醫診所,台南市中西區府前路一段182號
2273,承鴻中醫診所,台南市中西區南門路159之2號
2274,一安堂中醫診所,台南市中西區南門路185號之5
2275,富源中醫診所,台南市仁德區中正路二段480號
2276,祥元中醫診所,台南市中西區民族路三段198號
2277,陳德森內傷科中醫診所,台南市東區林森路一段192號
2278,王睿宏中醫診所,台南市東區長榮路二段162號
2279,祥恩中醫診所,台南市安平區建平路567號
2280,和氣中醫診所,台南市東區崇明路369號
2281,松裕堂中醫診所,花蓮市中正路637號
2282,萬順外科中醫診所,花蓮市中山路76號
2283,江瑞庭中醫診所,花蓮市富吉路59號
2284,隆安中醫診所,花蓮市中山路523號
2285,仁濟中醫診所,花蓮市中正路43號
2286,德恩中醫診所,花蓮市和平路472號
2287,杏林中醫診所,花蓮縣玉里鎮光復路170號
2288,國軍花蓮總醫院,花蓮縣新城鄉嘉里村嘉里路163號
2289,信欣中醫診所,花蓮市民國路26號
2290,至誠中醫診所,花蓮市富國路142號
2291,嘉德中醫診所,花蓮縣新城鄉嘉里村福德路1號
2292,林政昇中醫診所,花蓮縣吉安鄉中華路2段178號
2293,良美中醫診所,花蓮市富吉路3號
2294,大新中醫診所,花蓮市中正路142-1號
2295,保生中醫診所,花蓮市建國路2段288號
2296,大正中醫診所,花蓮縣壽豐鄉豐山村中山路146號
2297,漢華中醫診所,花蓮縣吉安鄉中山路三段123號
2298,樂田中醫診所,花蓮縣吉安鄉建國路一段231號
2299,原相中醫診所,花蓮市和平路332之2號
2300,鳳林中醫診所,花蓮縣鳳林鎮中正路二段185號
2301,林秉龍中醫,花蓮縣新城鄉北埔村民族路46號
2302,大和中醫診所,花蓮縣光復鄉中正路1段149號
2303,原德中醫診所,頭份市蟠桃里德義路102號
2304,健康中醫診所,頭份市自強路2段53號
2305,華杏中醫診所,公館鄉館東村大同路142號1樓
2306,慈恩中醫診所,後龍鎮中山路104號
2307,裕康中醫診所,公館鄉館東村14鄰大同路195號
2308,京鼎中醫聯合診所,苗栗市中山路662號
2309,康福中醫診所,頭份市和平里和平路43號
2310,京湛中醫診所,竹南鎮博愛街154號
2311,正中華中醫診所,頭份市中華路1121號
2312,豐順中醫診所,頭份市建國路2段160號
2313,保安堂中醫診所,頭份市中正路196號
2314,晨唐中醫診所,苗栗市英才路199號
2315,仁壽中醫診所,後龍鎮中龍街184號
2316,慈祐醫院中醫部,竹南鎮民治街17號
2317,保生堂中醫診所,苗栗市大同路130號
2318,郭豐演中醫診所,苗栗市建功里府前路81號
2319,林東宏中醫診所,竹南鎮光復路42-1號
2320,百漢中醫診所,苑裡鎮新興路31-12號
2321,尚德中醫診所,苗栗市府東路61號1樓
2322,南海中醫診所,苗栗市中山路789號
2323,吳家熙中醫診所,苗栗市中山路814號
2324,中山中醫診所,苗栗市為公路175號
2325,康然中醫診所,苗栗市中正路295號1樓
2326,科學中醫診所,頭份市中華路921號 新增
2327,慶福堂中醫診所,頭份市中山路60號
2328,彭賢正中醫診所,後龍鎮大庄里中山路202號
2329,聖祐中醫診所,三灣鄉三灣村民權街6號
2330,卓家老舖中醫診所,金門縣金沙鎮后浦頭3號
2331,大方中醫診所,金門縣金城鎮環島北路一段26號
2332,豐元中醫診所,金門縣金寧鄉仁愛新村139號
2333,張中醫診所,虎尾鎮中山路25號1樓
2334,文心中醫診所,西螺鎮福興路165-2號
2335,弘恩中醫診所,雲林縣斗六市中華路288號1樓
2336,至誠堂中醫診所,北港鎮南安里光明路37號
2337,光晟中醫診所,虎尾鎮公安里林森路1段360巷7-2號
2338,大成中醫聯合診所,斗六市鎮東路117號
2339,源茂中醫診所,北港鎮大同里大同路120號
2340,建成中醫診所,西螺鎮光華里延平路400號
2341,東方虎尾中醫診所,虎尾鎮中正路329號
2342,國際中醫診所,斗南鎮民權路31號
2343,明德堂中醫診所,虎尾鎮民族路23-3號
2344,南光中醫診所,虎尾鎮新生路62-1號1樓
2345,至善中醫診所,虎尾鎮新興里光復路303號
2346,國賢中醫診所,雲林縣斗六市明德北路3段355號
2347,元氣堂中醫診所,虎尾鎮東明路126號
2348,扶原中醫診所,崙背鄉大業路28號
2349,雲林基督教醫院,西螺鎮新豐里市場南路375號
2350,安賢中醫診所,斗六市上海路136號1樓
2351,復春中醫診所,西螺鎮正興里光復西路120號
2352,黃憲唐中醫診所,斗六市北平路42號
2353,菩義霖中醫診所,斗南鎮新興街130號
2354,一品堂中醫診所,斗六市忠孝里永安路46號
2355,中國醫藥大學北港附設醫院,北港鎮新街里新德路123號
2356,觀心中醫診所,土庫鎮中正路96-3號
2357,天主教若瑟醫院,虎尾鎮新生路74號
2358,宏安中醫診所,二崙鄉中山路171號
2359,泰成中醫診所,林內鄉中山路2-3號
2360,一品堂虎尾中醫診所,虎尾鎮信義路38號、40號之1樓
2361,崇德中醫診所,斗六市文化路69號
2362,陳銘斌中醫診所,水林鄉水北村水林路104號
2363,虎尾鎮農會附設中醫診所,虎尾鎮新興里光復路185號
2364,上祐中醫診所,斗六市民生南路107號
2365,一古堂中醫診所,莿桐鄉中正路66巷19之2號
2366,永傳中醫診所,褒忠鄉中民路133號
2367,保生堂中醫診所,莿桐鄉莿桐村中山路173號
2368,蘭心中醫診所,斗六市中堅西路228號1樓
2369,明鴻內婦科中醫診所,高雄市三民區義華路332號
2370,善德中醫診所,高雄市三民區皓東路171之4、171之5號
2371,高雄市立聯合醫院中醫科,高雄市鼓山區中華一路976號
2372,大雄中醫診所,高雄市苓雅區興中一路247號
2373,勝南中醫診所,高雄市三民區灣中街253號
2374,九如中醫診所,高雄市三民區九如二路456、458號1樓
2375,橋頭馬光中醫診所,高雄市橋頭區樹德路30號
2376,意凡馬光中醫診所,高雄市左營區店仔頂路32號
2377,佑昌馬光中醫診所,高雄市楠梓區德民路923號
2378,崇心中醫診所,高雄市苓雅區林森二路142號1、2樓
2379,明華馬光中醫診所,高雄市左營區明華一路192號
2380,心保泰中醫診所,高雄市鳳山區保泰路150號
2381,建功馬光中醫診所,高雄市三民區建工路700號1-3樓
2382,光華馬光中醫診所,高雄市苓雅區光華一路148-23號1-2樓
2383,尚揚馬光中醫診所,高雄市鳳山區文安街26號
2384,宸品中醫診所,高雄市新興區七賢一路510號1樓
2385,天乙中醫診所,高雄市三民區正興路187號
2386,趙家瑩中醫診所,高雄市前鎮區二聖一路98號
2387,翰林中醫診所,高雄市前金區中華三路179號1樓
2388,誠德中醫診所,高雄市三民區自立一路305、305之1號1樓
2389,得心中醫診所,高雄市彌陀區中正路93號
2390,禾豐中醫診所,高雄市鳳山區鳳松路300號
2391,行樂親子中醫診所,高雄市鼓山區華榮路432號
2392,惠德中醫診所,高雄市左營區華夏路220號
2393,康和中醫診所,高雄市新興區五福一路128號1樓
2394,趙望吉中醫診所,高雄市三民區九如一路913號
2395,陽明中醫診所,高雄市三民區覺民路586號
2396,張倩華中醫診所,高雄市新興區林森一路111號1樓
2397,天主教聖功醫院,高雄市苓雅區建國一路352號
2398,一生堂中醫診所,高雄市苓雅區光華一路33號1樓
2399,普笙中醫診所,高雄市苓雅區廣州一街121號1樓
2400,鼻安中醫診所,高雄市三民區民族一路7號1樓
2401,劉楠賢中醫診所,高雄市三民區正興路89號
2402,右東中醫診所,高雄市前鎮區一心一路243-2號
2403,進安中醫診所,高雄市三民區熱河一街351號
2404,元氣中醫診所,高雄市鼓山區裕誠路1509之6號
2405,明道中醫診所,高雄市鼓山區美術館路79號
2406,三民承德中醫診所,高雄市三民區大豐二路288號1樓
2407,泓民中醫診所,高雄市岡山區仁壽路36號
2408,福康中醫診所,高雄市小港區沿海一路347號1、2樓
2409,瑞安中醫診所,高雄市三民區陽明路392號1樓
2410,福悅中醫診所,高雄市新興區七賢一路398號
2411,新恩中醫診所,高雄市鳳山區鎮南街70號
2412,新世紀中醫診所,高雄市三民區河堤路592號1、2樓
2413,濟安中醫診所,高雄市新興區忠孝一路188號
2414,銘祥中醫診所,高雄市三民區立忠路2之1號
2415,莊敬中醫診所,高雄市三民區莊敬路11號
2416,漢芳中醫診所,高雄市三民區建工路481號
2417,博雄中醫診所,高雄市三民區博愛一路33號
2418,福濟中醫診所,高雄市前鎮區翠亨北路271號
2419,有德中醫診所,高雄市苓雅區建國一路89號
2420,衫宥中醫診所,高雄市三民區建工路393號1、2樓
2421,調明中醫診所,高雄市苓雅區三多二路263、265號1、2樓
2422,大成中醫診所,高雄市苓雅區正言路76號
2423,福祐中醫診所,高雄市前鎮區二聖二路301號
2424,泓德中醫診所,高雄市前鎮區和平二路284號1樓
2425,衛生福利部旗山醫院中醫科,高雄市旗山區中學路60號
2426,高雄榮民總醫院傳統醫學科,高雄市左營區大中一路386號
2427,高雄市立中醫醫院,高雄市苓雅區凱旋二路132號1至3樓
2428,高雄市立岡山醫院,高雄市岡山區壽天路12號
2429,高雄醫學大學附設醫院中醫部,高雄市三民區十全一路100號
2430,高雄市立旗津醫院中醫科,高雄市旗津區旗港路33號
2431,博田國際醫院中醫科,高雄市左營區博愛二路100號
2432,中仁內婦科中醫診所,高雄市鹽埕區大仁路127號
2433,黃志忠中醫診所,高雄市鼓山區麗雄街49號
2434,文騫中醫診所,高雄市鼓山區西藏街320號
2435,頂立中醫診所,高雄市鼓山區鼓山三路51巷31弄15號
2436,百祐中醫聯合診所,高雄市左營區左營大路14之2號
2437,健誠中醫診所,高雄市左營區部後街34號
2438,展佳中醫診所,高雄市左營區元帝路76號1樓
2439,恆德堂中醫診所,高雄市左營區富民路338之5號
2440,安和中醫診所,高雄市左營區自由三路343號1-2樓
2441,活水中醫診所,高雄市左營區富民路159號
2442,精進中醫診所,高雄市楠梓區德民路222號
2443,漢唐中醫診所,高雄市楠梓區德祥路189號
2444,泰安內外科中醫診所,高雄市三民區建國二路156號
2445,育生中醫診所,高雄市三民區昌裕街174號
2446,楊濟鴻中醫診所,高雄市三民區北平二街29號
2447,蕭穎士中醫診所,高雄市三民區九如一路72號
2448,港泰中醫診所,高雄市三民區博愛一路100號
2449,永安中醫診所,高雄市三民區瀋陽街109號
2450,天惠中醫診所,高雄市三民區天祥一路199號
2451,張瑞璋中醫診所,高雄市三民區自由一路91號
2452,國源堂中醫診所,高雄市三民區建國二路170、172號
2453,林吉原中醫診所,高雄市三民區明仁路18號1、2樓
2454,鼎金中醫診所,高雄市三民區大豐二路160號1樓
2455,劉如鎮中醫診所,高雄市三民區康德街50號
2456,濟世中醫診所,高雄市三民區覺民路39號
2457,澄清中醫診所,高雄市三民區澄平街218號
2458,育森中醫診所,高雄市三民區鼎中路213號
2459,佳德中醫診所,高雄市新興區復興一路97號
2460,詠豐中醫診所,高雄市新興區自立一路24號
2461,大德中醫診所,高雄市新興區六合一路96巷6號1樓
2462,永康中醫診所,高雄市新興區復興一路119號
2463,再生好中醫診所,高雄市新興區自立一路34號
2464,慶元內科中醫診所,高雄市苓雅區大順三路274號
2465,獅甲中醫診所,高雄市苓雅區三多三路214之10號
2466,素琴中醫診所,高雄市苓雅區學源街9號
2467,健原中醫診所,高雄市苓雅區忠孝二路8號
2468,立群中醫診所,高雄市苓雅區五權街248號
2469,大歡中醫診所,高雄市苓雅區四維一路280號
2470,博愛中醫診所,高雄市苓雅區建國一路147號
2471,蔡志君中醫診所,高雄市苓雅區林森二路11之2號
2472,奇詮中醫診所,高雄市苓雅區福德三路220號
2473,成功濟世中醫診所,高雄市苓雅區青年二路149號
2474,宏安中醫診所,高雄市前鎮區鎮興路101號
2475,全慶中醫診所,高雄市前鎮區瑞隆路548號1、2樓
2476,正心中醫診所,高雄市前鎮區忠誠路217、219號
2477,大盛中醫診所,高雄市前鎮區永豐路216號
2478,安慶中醫診所,高雄市前鎮區凱旋四路338號
2479,醫心館中醫診所,高雄市前鎮區一心一路370號
2480,德生中醫診所,高雄市前鎮區中平路278號1樓
2481,濟仁中醫診所,高雄市前鎮區瑞福路141號
2482,民權中醫診所,高雄市前鎮區民權二路416號1樓
2483,陳建霖中醫診所,高雄市前鎮區三多三路143號
2484,慈惠中醫診所,高雄市旗津區中州巷40號
2485,鳳中中醫診所,高雄市小港區二苓路222號
2486,盧家中醫診所,高雄市鳳山區鳳南路167號1樓
2487,鳳山濟世中醫診所,高雄市鳳山區中山東路72號
2488,仁一中醫診所,高雄市鳳山區文德街31號1樓
2489,湞宸中醫診所,高雄市鳳山區瑞隆東路256號1樓
2490,乙元中醫診所,高雄市鳳山區建國路二段59之1號
2491,文龍中醫診所,高雄市鳳山區文龍東路160號
2492,鳳城中醫診所,高雄市鳳山區勝利路53號
2493,德佐中醫診所,高雄市鳳山區文龍東路276號
2494,惠仁堂中醫診所,高雄市旗山區復新街11號
2495,仁美中醫診所,高雄市仁武區中正路138號
2496,乙茆中醫診所,高雄市仁武區仁和街12號1樓
2497,一心堂中醫診所,高雄市橋頭區橋頭里新興路23號
2498,佳原中醫診所,高雄市茄萣區仁愛路二段86號
2499,保安堂中醫診所,高雄市梓官區梓官路城隍巷22號
2500,甘恩中醫診所,高雄市梓官區中正路100號
2501,元生華榮中醫診所,高雄市鼓山區華榮路214號
2502,華藏中醫診所,高雄市鼓山區九如四路758號
2503,福得中醫診所,高雄市鼓山區明華路333號
2504,詠心中醫診所,高雄市鼓山區華榮路291、293號1樓
2505,裕順中醫診所,高雄市鼓山區美術東二路106號
2506,慈恩中醫診所,高雄市鼓山區九如四路1470號
2507,保生中醫診所,高雄市左營區自由四路147號1樓
2508,昶陞中醫診所,高雄市左營區孟子路419號1樓
2509,爵安堂中醫診所,高雄市左營區立大路133號
2510,青松堂中醫診所,高雄市左營區華夏路765號
2511,宏福中醫診所,高雄市左營區自由四路1、3號1、2樓
2512,榮景中醫診所,高雄市左營區榮成一街17號
2513,高鐵中醫診所,高雄市左營區華夏路1108號
2514,元真中醫診所,高雄市左營區光興街235號
2515,德滿堂中醫診所,高雄市左營區重愛路356號1樓
2516,謝育霖中醫診所,高雄市左營區至聖路171號
2517,六必居中醫診所,高雄市左營區文學路255、257號1樓
2518,正大左營中醫診所,高雄市左營區富國路41號1、2樓
2519,嘉安中醫診所,高雄市左營區新庄仔路237之1號1樓
2520,韻心中醫診所,高雄市左營區軍校路610號
2521,醫晟中醫診所,高雄市左營區裕誠路266號
2522,天蘊中醫診所,高雄市左營區文自路226號1樓
2523,仁德中醫診所,高雄市楠梓區建楠路182號
2524,思恩堂中醫診所,高雄市楠梓區大學南路603號
2525,鼎泰堂中醫診所,高雄市三民區河堤路490號
2526,蕙林中醫診所,高雄市三民區寶興路38號
2527,聖和中醫診所,高雄市三民區建國三路367號1、2樓
2528,鴻生中醫診所,高雄市三民區義德路85號
2529,亨木中醫診所,高雄市三民區山東街94號
2530,宥程中醫診所,高雄市三民區興隆街6號1、2樓
2531,鉑氏美中醫診所,高雄市三民區十全一路215號1樓
2532,五福中醫診所,高雄市新興區五福二路35號1樓
2533,永森中醫診所,高雄市新興區中山一路276號
2534,天恩中醫診所,高雄市新興區青年一路138號
2535,凱璿中醫診所,高雄市新興區民生一路330號
2536,民馨中醫診所,高雄市新興區中正三路5號
2537,合佗中醫診所,高雄市新興區六合路85號
2538,國醫堂中醫診所,高雄市新興區青年一路452、454號1樓
2539,仁馨中醫診所,高雄市苓雅區英明路118之1、120號1樓
2540,太壹中醫診所,高雄市苓雅區興中一路46號
2541,正義中醫診所,高雄市苓雅區正義路149號
2542,博安中醫診所,高雄市苓雅區福德二路12號
2543,家康中醫診所,高雄市苓雅區福安路15號1樓
2544,杉合中醫診所,高雄市苓雅區中正二路20號
2545,高雄漢唐中醫診所,高雄市苓雅區中山二路410號8樓
2546,默默中醫診所,高雄市苓雅區三多二路157號
2547,金湛中醫診所,高雄市前鎮區黃埔街28號
2548,心路中醫診所,高雄市前鎮區一心二路86號
2549,杏安中醫診所,高雄市小港區宏平路347號
2550,牧水中醫診所,高雄市小港區山明路166、168號1樓
2551,小港濟世中醫診所,高雄市小港區沿海一路49號
2552,宏霖中醫診所,高雄市三民區陽明路72號
2553,康喬中醫診所,高雄市楠梓區德民路999之7號
2554,進祥中醫診所,高雄市左營區華夏路213號
2555,祐祥中醫診所,高雄市楠梓區右昌街718號1樓
2556,義大醫療財團法人義大癌治療醫院,高雄市燕巢區義大路21號
2557,五乙中醫診所,高雄市楠梓區興楠路17號
2558,祥霖中醫診所,高雄市三民區聯興路125號
2559,濟民中醫診所,高雄市新興區中山一路61號
